Wer spielte den Paten im gleichnamigen Film von 1972?;Robert de Niro;Vito Corleone;Al Pacino;Marlon Brando;4
Wessen Karriere wurde durch den Erfolg von Pulp Fiction wiederbelebt?;Samuel L. Jackson;Quentin Tarantino;John Travolta;Bruce Willis;3
In welchem Film spielt Tom Hanks einen Vietnam-Veteranen?;Road to Perdition;Forrest Gump;Der Soldat James Ryan;Catch Me If You Can;2
Wie ist der Name der Hauptfigur im Film Matrix?;Cypher;Neo;Morpheus;Agent Smith;2
Zu welcher Spezies gehört Chewbacca in den Star Wars Filmen?;Tusken;Sith;Jawa;Wookiee;4
Wessen Film-Karriere fing mit dem Film „Léon – Der Profi“ an?;Natalie Portman;Megan Fox;Milla Jovovich;Jean Reno;1
Was will Indiana Jones im Film „Jäger des verlorenen Schatzes“ finden?;Inka-Statue;Heilige Gral;Kristallschädel;Bundeslade;4
In welches Jahr reist der Terminator im ersten Film?;1984;1999;1994;1986;1
Welche Gabe hatte der Gefangene John Coffey im Film „The Green Mile“?;Krankheiten heilen;In die Zukunft zu schauen;Durch Wände gehen;Unsterblich sein;1
Welcher zählt laut vielen Umfragen als „schlechtester US-Film aller Zeiten“?;Glen or Glenda;Sharknado;Plan 9 from Outer Space;Star Wars: Episode I;3
Zu welchem Datum reisen Marty und Doc im Film „Zurück in die Zukunft 2“?;16.10.2025;21.10.2015;24.10.2024;10.10.2005;2
Wer ist der Lieblingskomponist von Ales im Film „A Clockwork Orange“?;Mozart;Vivaldi;Bach;Beethoven;4
Wie heißt der Schiffscomputer in Kubrick's „2001 – Odyssee im Weltraum“?;COM 4000;HAL 9000;COM 1337;HAL 7000;2
Wie heißt das Raumschiff im ersten Alien-Film?;Weyland;Ripley;Sulaco;Nostromo;4
Wer spielte den „Großen Diktator“ im gleichnamigen Film von 1940?;Charles Chaplin;Spencer Tracy;Orson Welles;Humphrey Bogart;1
Was war der frühere Beruf von Dr. King Schultz im Film „Django Unchained“?;Jurist;Landarzt;Zahnarzt;Chirurg;3
Wie heißt Simba's Vater im Film „Der König der Löwen“?;Timon;Rafiki;Mufasa;Zazu;3
Was passiert mit Jack Nicholson's Charakter am Ende von „The Shining“?;Er erfriert;Er fällt die Treppe runter;Er flüchtet;Er verirrt sich;1
Wer spielt den Protagonist in „Lawrence von Arabien“ aus dem Jahr 1962?;Anthony Quinn;Omar Sharif;Alec Guinness;Peter O'Toole;4
Wie stirbt die Hauptfigur William Wallace im Film „Braveheart“?;Vierteilung;Folter;Galgen;Enthauptung;4
Welcher Soldat nimmt sich im Film „Full Metal Jacket“ das Leben?;Private Joker;Private Paula;Sergeant Animal Mother;Sergeant Cowboy;2
Welches Tier tötet einige Ritter der Tafelrunde in „Die Ritter der Kokosnuss“?;Kaninchen;Drache;Taube;Wolf;1
Wer spielt Indy's Vater im Film „Indiana Jones und der letzte Kreuzzug“?;Sean Connery;Billy Connolly;Clint Eastwood;Christopher Lee;1
Welches ist das Lieblingsgetränk vom Dude in „The Big Lebowski“?;Bier;Cuba Libre;White Russian;Wein;3
Mit welchem Film wurde Sylvester Stallone berühmt?;Rambo;Rocky;Demolition Man;Judge Dredd;2
Wie sieht Doctor Who's Gefährt aus, womit er durch Raum und Zeit reist?;Schwarze Telefonzelle;Grünes Raumschiff;Blaue Telefonzelle;Graue Kapsel;3
Welche Tiere werden im Film „Star Trek 4“ in der Vergangenheit gerettet?;Schimpansen;Delfine;Dinosaurier;Wale;4
Welche Szene zählt zu den bekanntesten im Blues Brother Film?;Explodierendes Gebäude;Auftritt der Western-Band;Zerstörte Polizeiautos;Verhaftung der Band;3
Welches Fach müssen Bill und Ted in ihrer Reise durch die Zeit“ bestehen?;Geschichte;Englisch;Mathe;Biologie;1
Welche Gestalt nimmt der böse Gott am Ende des Films „Ghostbusters“ an?;Riesenaffe;Riesenechse;Marshmallow Mann;Donut Mann;3
Wie viele Oscars gewann der Film „Titanic“?;8;14;10;11;4
Welcher Planet wird in „Star Wars Episode IV: A New Hope“ zerstört?;Alderaan;Tatooine;Kashyyyk;Hoth;1
"Welchen Geburtstag feiert Bilbo Beutlin in ""Der Herr der Ringe: Die Gefährten""?";100.;111.;99.;123.;2
Wer spielt die Hauptfigur im Film „Die Hard“?;Arnold Schwarzenegger;Tom Cruise;Jean-Claude Van Damme;Bruce Willis;4
Wie heißt die Gruppe, der Brian im Film „Das Leben des Brian“ mitmacht?;Judäische Volksfront;Kampagne für ein freies Galiläa;Volksfront von Judäa;Populäre Front;3
Womit befreit Butch seinen Ex-Boss Marsellus im Film „Pulp Fiction“?;Katana;Hammer;Motorsäge;Baseballschläger;1
Wer spielte die Hauptfigur im Film „Der Zauberer von Oz“ von 1939?;Judy Garland;Doris Day;Marilyn Monroe;Audrey Hepburn;1
Welcher Hitchcock-Film zählt als einer der besten Horrorfilme aller Zeiten?;Die Vögel;Psycho;Der Exorzist;Bei Anruf Mord;2
Wie heißt der Serienkiller im Film „The Texas Chain Saw Massacre“?;Pennywise/ES;Freddy Krueger;Jason Voorhees;Leatherface;4
Wer spielt die Hauptfigur im Film „Blade Runner“ von 1982?;Dolph Lundgren;Rutger Hauer;Harrison Ford;Mel Gibson;3
Woraus besteht die Nahrung Soylent Green im gleichnamigen Film von 1973?;Soja;Linsen;Rinder;Menschen;4
Wie viele Brüder hatte James Ryan im Film „Der Soldat James Ryan“?;1;2;3;4;3
Welcher Film spielte bisher am meisten Geld ein?;Frozen;The Avengers;Titanic;Avatar;4
Wie nennt Bilbo Beutlin sein Schwert im Film „Der Hobbit: Smaugs Einöde“?;Stich;Orcrist;Glamdring;Narsil;1
Wie heißt Harry Potter's Eule?;Nagini;Hedwig;Krätze;Krummbein;2
Zu welcher Spezies gehört Nemo im Film „Findet Nemo“?;Palettendoktorfisch;Clownfisch;Halfterfisch;Königs-Feenbarsch;3
Womit werden in „Independence Day“ die Schilde der Raumschiffe deaktiviert?;Atombombe;Sabotage;Raketen;Computervirus;4
Wie ist der Hacker-Spitzname von der Hauptfigur im Film „Hackers“ von 1995?;Acid Burn;Phantom Phreak;Crash Override;Cereal Killer;3
Gegen welchen Gott kämpfen die Hauptfiguren im Film „Stargate“ von 1994?;Ra;Apophis;Horus;Seth;1
In welches Körperteil wird Forrest Gump in Vietnam geschossen?;Arm;Bein;Hintern;Rücken;3
